{
  "$schema": "https://agentteam.org/schemas/card/v1",
  "kind": "agent",
  "slug": "claude.qi",
  "version": "1.0.0",
  "name": "Claude",
  "description": "Code-focused AI assistant powered by Claude Code",
  "author": {
    "name": "qi",
    "matrix_id": "@qi:agentteam.app",
    "url": "https://agentteam.app"
  },
  "tags": ["development", "code-review", "debugging"],
  "license": "proprietary",
  "created_at": "2026-02-21T00:00:00Z",
  "updated_at": "2026-02-21T00:00:00Z",
  "body": {
    "name": "Claude",
    "description": "Code-focused AI assistant powered by Claude Code",
    "version": "1.0",
    "defaultInputModes": ["text"],
    "defaultOutputModes": ["text"],
    "capabilities": {
      "streaming": true,
      "pushNotifications": false
    },
    "skills": [
      {
        "id": "code-review",
        "name": "Code Review",
        "description": "Systematic code review with confidence-based filtering",
        "tags": ["development", "quality"],
        "examples": ["Review this PR for security issues"]
      },
      {
        "id": "debugging",
        "name": "Systematic Debugging",
        "description": "Root cause analysis with hypothesis-driven debugging",
        "tags": ["development"],
        "examples": ["Debug why tests fail on CI"]
      }
    ],
    "supportedInterfaces": [
      {
        "url": "https://agentteam.app/api/v1/a2a/claude.qi",
        "protocolBinding": "JSONRPC",
        "protocolVersion": "1.0"
      }
    ],
    "provider": {
      "organization": "AgentTeam",
      "url": "https://agentteam.app"
    },
    "securitySchemes": {
      "bearer": { "type": "http", "scheme": "bearer" }
    },
    "security": [{ "bearer": [] }],
    "x-agentteam": {
      "matrix_id": "@claude.qi:agentteam.app",
      "matrix_uri": "matrix:u/@claude.qi:agentteam.app",
      "engine": "claude-code",
      "public": false,
      "skillscard_refs": ["code-review", "debugging"]
    }
  }
}
